{
  "id": "FEATURE-001",
  "type": "feature-intake",
  "status": "stabilized",
  "title": "ticket_paths should be project-root-relative",
  "description": "Current ticket_paths use paths relative to the milestones file location (e.g., 'tickets/T1.1.json'). This creates ambiguity when milestones move between directories. Paths should be relative to the project root (e.g., 'project-management/data/tickets/T1.1.json') for unambiguous resolution.",
  "domain": "Shared",
  "priority": "medium",
  "ambiguity_score": 0,
  "questions": [
    {
      "question": "Should paths be relative to project root or absolute?",
      "proposed_options": [
        { "label": "Project root relative", "value": "root_relative", "description": "Paths like project-management/data/tickets/T1.1.json" },
        { "label": "Absolute", "value": "absolute", "description": "Full filesystem paths — not portable" }
      ],
      "operator_response": {
        "selected_option": "root_relative",
        "rationale": "Portable across environments and clone locations"
      },
      "resolved": true
    }
  ],
  "operator_override": false,
  "created_at": "2026-05-22T17:00:00Z",
  "updated_at": "2026-05-22T17:00:00Z"
}
